{
  "schemaVersion": "1.0",
  "objectType": "Actor",
  "objectId": "MANAGER-01",
  "revision": 1,
  "createdAt": "2026-09-25T06:36:03.396Z",
  "updatedAt": "2026-09-25T06:36:03.396Z",
  "events": [
    "EVT-001001"
  ],
  "actorType": "MANAGER",
  "enabled": true,
  "displayName": "Arena Manager"
}
